============================= test session starts ==============================
platform darwin -- Python 3.11.2, pytest-8.3.5, pluggy-1.5.0 -- /Library/Frameworks/Python.framework/Versions/3.11/bin/python3
cachedir: .pytest_cache
metadata: {'Python': '3.11.2', 'Platform': 'macOS-15.7.1-arm64-arm-64bit', 'Packages': {'pytest': '8.3.5', 'pluggy': '1.5.0'}, 'Plugins': {'logfire': '4.11.0', 'timeout': '2.2.0', 'anyio': '4.11.0', 'html': '4.1.1', 'json-report': '1.5.0', 'metadata': '3.1.1', 'cov': '4.1.0', 'asyncio': '0.25.3', 'order': '1.3.0', 'benchmark': '5.1.0', 'mock': '3.14.0', 'xdist': '3.6.1', 'docker': '3.1.1'}}
benchmark: 5.1.0 (defaults: timer=time.perf_counter disable_gc=False min_rounds=5 min_time=0.000005 max_time=1.0 calibration_precision=10 warmup=False warmup_iterations=100000)
rootdir: /Volumes/PRO-G40/Code/omniarchon/python
configfile: pytest.ini
plugins: logfire-4.11.0, timeout-2.2.0, anyio-4.11.0, html-4.1.1, json-report-1.5.0, metadata-3.1.1, cov-4.1.0, asyncio-0.25.3, order-1.3.0, benchmark-5.1.0, mock-3.14.0, xdist-3.6.1, docker-3.1.1
asyncio: mode=Mode.AUTO, asyncio_default_fixture_loop_scope=function
collecting ... collected 759 items / 5 errors

==================================== ERRORS ====================================
_____________ ERROR collecting tests/test_async_source_summary.py ______________
ImportError while importing test module '/Volumes/PRO-G40/Code/omniarchon/python/tests/test_async_source_summary.py'.
Hint: make sure your test modules/packages have valid Python names.
Traceback:
/Users/jonah/Library/Python/3.11/lib/python/site-packages/_pytest/python.py:493: in importtestmodule
    mod = import_path(
/Users/jonah/Library/Python/3.11/lib/python/site-packages/_pytest/pathlib.py:587: in import_path
    importlib.import_module(module_name)
/Library/Frameworks/Python.framework/Versions/3.11/lib/python3.11/importlib/__init__.py:126: in import_module
    return _bootstrap._gcd_import(name[level:], package, level)
<frozen importlib._bootstrap>:1206: in _gcd_import
    ???
<frozen importlib._bootstrap>:1178: in _find_and_load
    ???
<frozen importlib._bootstrap>:1149: in _find_and_load_unlocked
    ???
<frozen importlib._bootstrap>:690: in _load_unlocked
    ???
/Users/jonah/Library/Python/3.11/lib/python/site-packages/_pytest/assertion/rewrite.py:185: in exec_module
    exec(co, module.__dict__)
tests/test_async_source_summary.py:14: in <module>
    from src.server.services.crawling.document_storage_operations import (
src/server/services/crawling/__init__.py:9: in <module>
    from .crawling_service import (
src/server/services/crawling/crawling_service.py:36: in <module>
    from .helpers.site_config import SiteConfig
src/server/services/crawling/helpers/__init__.py:7: in <module>
    from .site_config import SiteConfig
src/server/services/crawling/helpers/site_config.py:7: in <module>
    from crawl4ai.markdown_generation_strategy import DefaultMarkdownGenerator
E   ModuleNotFoundError: No module named 'crawl4ai'
______________ ERROR collecting tests/test_source_id_refactor.py _______________
ImportError while importing test module '/Volumes/PRO-G40/Code/omniarchon/python/tests/test_source_id_refactor.py'.
Hint: make sure your test modules/packages have valid Python names.
Traceback:
/Users/jonah/Library/Python/3.11/lib/python/site-packages/_pytest/python.py:493: in importtestmodule
    mod = import_path(
/Users/jonah/Library/Python/3.11/lib/python/site-packages/_pytest/pathlib.py:587: in import_path
    importlib.import_module(module_name)
/Library/Frameworks/Python.framework/Versions/3.11/lib/python3.11/importlib/__init__.py:126: in import_module
    return _bootstrap._gcd_import(name[level:], package, level)
<frozen importlib._bootstrap>:1206: in _gcd_import
    ???
<frozen importlib._bootstrap>:1178: in _find_and_load
    ???
<frozen importlib._bootstrap>:1149: in _find_and_load_unlocked
    ???
<frozen importlib._bootstrap>:690: in _load_unlocked
    ???
/Users/jonah/Library/Python/3.11/lib/python/site-packages/_pytest/assertion/rewrite.py:185: in exec_module
    exec(co, module.__dict__)
tests/test_source_id_refactor.py:12: in <module>
    from src.server.services.crawling.helpers.url_handler import URLHandler
src/server/services/crawling/__init__.py:9: in <module>
    from .crawling_service import (
src/server/services/crawling/crawling_service.py:36: in <module>
    from .helpers.site_config import SiteConfig
src/server/services/crawling/helpers/__init__.py:7: in <module>
    from .site_config import SiteConfig
src/server/services/crawling/helpers/site_config.py:7: in <module>
    from crawl4ai.markdown_generation_strategy import DefaultMarkdownGenerator
E   ModuleNotFoundError: No module named 'crawl4ai'
_____________ ERROR collecting tests/test_url_canonicalization.py ______________
ImportError while importing test module '/Volumes/PRO-G40/Code/omniarchon/python/tests/test_url_canonicalization.py'.
Hint: make sure your test modules/packages have valid Python names.
Traceback:
/Users/jonah/Library/Python/3.11/lib/python/site-packages/_pytest/python.py:493: in importtestmodule
    mod = import_path(
/Users/jonah/Library/Python/3.11/lib/python/site-packages/_pytest/pathlib.py:587: in import_path
    importlib.import_module(module_name)
/Library/Frameworks/Python.framework/Versions/3.11/lib/python3.11/importlib/__init__.py:126: in import_module
    return _bootstrap._gcd_import(name[level:], package, level)
<frozen importlib._bootstrap>:1206: in _gcd_import
    ???
<frozen importlib._bootstrap>:1178: in _find_and_load
    ???
<frozen importlib._bootstrap>:1149: in _find_and_load_unlocked
    ???
<frozen importlib._bootstrap>:690: in _load_unlocked
    ???
/Users/jonah/Library/Python/3.11/lib/python/site-packages/_pytest/assertion/rewrite.py:185: in exec_module
    exec(co, module.__dict__)
tests/test_url_canonicalization.py:8: in <module>
    from src.server.services.crawling.helpers.url_handler import URLHandler
src/server/services/crawling/__init__.py:9: in <module>
    from .crawling_service import (
src/server/services/crawling/crawling_service.py:36: in <module>
    from .helpers.site_config import SiteConfig
src/server/services/crawling/helpers/__init__.py:7: in <module>
    from .site_config import SiteConfig
src/server/services/crawling/helpers/site_config.py:7: in <module>
    from crawl4ai.markdown_generation_strategy import DefaultMarkdownGenerator
E   ModuleNotFoundError: No module named 'crawl4ai'
__________________ ERROR collecting tests/test_url_handler.py __________________
ImportError while importing test module '/Volumes/PRO-G40/Code/omniarchon/python/tests/test_url_handler.py'.
Hint: make sure your test modules/packages have valid Python names.
Traceback:
/Users/jonah/Library/Python/3.11/lib/python/site-packages/_pytest/python.py:493: in importtestmodule
    mod = import_path(
/Users/jonah/Library/Python/3.11/lib/python/site-packages/_pytest/pathlib.py:587: in import_path
    importlib.import_module(module_name)
/Library/Frameworks/Python.framework/Versions/3.11/lib/python3.11/importlib/__init__.py:126: in import_module
    return _bootstrap._gcd_import(name[level:], package, level)
<frozen importlib._bootstrap>:1206: in _gcd_import
    ???
<frozen importlib._bootstrap>:1178: in _find_and_load
    ???
<frozen importlib._bootstrap>:1149: in _find_and_load_unlocked
    ???
<frozen importlib._bootstrap>:690: in _load_unlocked
    ???
/Users/jonah/Library/Python/3.11/lib/python/site-packages/_pytest/assertion/rewrite.py:185: in exec_module
    exec(co, module.__dict__)
tests/test_url_handler.py:3: in <module>
    from src.server.services.crawling.helpers.url_handler import URLHandler
src/server/services/crawling/__init__.py:9: in <module>
    from .crawling_service import (
src/server/services/crawling/crawling_service.py:36: in <module>
    from .helpers.site_config import SiteConfig
src/server/services/crawling/helpers/__init__.py:7: in <module>
    from .site_config import SiteConfig
src/server/services/crawling/helpers/site_config.py:7: in <module>
    from crawl4ai.markdown_generation_strategy import DefaultMarkdownGenerator
E   ModuleNotFoundError: No module named 'crawl4ai'
_____ ERROR collecting tests/unit/services/test_kafka_consumer_service.py ______
ImportError while importing test module '/Volumes/PRO-G40/Code/omniarchon/python/tests/unit/services/test_kafka_consumer_service.py'.
Hint: make sure your test modules/packages have valid Python names.
Traceback:
/Users/jonah/Library/Python/3.11/lib/python/site-packages/_pytest/python.py:493: in importtestmodule
    mod = import_path(
/Users/jonah/Library/Python/3.11/lib/python/site-packages/_pytest/pathlib.py:587: in import_path
    importlib.import_module(module_name)
/Library/Frameworks/Python.framework/Versions/3.11/lib/python3.11/importlib/__init__.py:126: in import_module
    return _bootstrap._gcd_import(name[level:], package, level)
<frozen importlib._bootstrap>:1206: in _gcd_import
    ???
<frozen importlib._bootstrap>:1178: in _find_and_load
    ???
<frozen importlib._bootstrap>:1149: in _find_and_load_unlocked
    ???
<frozen importlib._bootstrap>:690: in _load_unlocked
    ???
/Users/jonah/Library/Python/3.11/lib/python/site-packages/_pytest/assertion/rewrite.py:185: in exec_module
    exec(co, module.__dict__)
tests/unit/services/test_kafka_consumer_service.py:20: in <module>
    from src.server.services.kafka_consumer_service import (
src/server/services/kafka_consumer_service.py:23: in <module>
    from omnibase_core.container import ModelONEXContainer as ONEXContainer
E   ModuleNotFoundError: No module named 'omnibase_core'
=========================== short test summary info ============================
ERROR tests/test_async_source_summary.py
ERROR tests/test_source_id_refactor.py
ERROR tests/test_url_canonicalization.py
ERROR tests/test_url_handler.py
ERROR tests/unit/services/test_kafka_consumer_service.py
!!!!!!!!!!!!!!!!!!! Interrupted: 5 errors during collection !!!!!!!!!!!!!!!!!!!!
======================== 11 warnings, 5 errors in 7.71s ========================
